{
  "selected_route": true,
  "selected_route_id": "route-fingerprint-then-target",
  "grade": "A+",
  "score_out_of_10": 9.72,
  "threshold": "A+ >= 9.70",
  "why_this_route_wins": "It rejects stale-plan mutation, proves the current surface first, quarantines private/internal material, and promotes truth state only after targeted proof.",
  "winning_score_factors": [
    "current evidence before mutation",
    "tight public/private boundary",
    "narrow reversible patch",
    "targeted verification",
    "explicit truth-state ceiling"
  ],
  "rejected_route_summary": "The stale dashboard plan was too broad; boundary-only was safer but slower; human-plan deferral was unnecessary while local proof was available.",
  "rejected_route_receipts": [
    "route-run-stale-plan",
    "route-boundary-quarantine-only",
    "route-defer-for-human-plan"
  ],
  "route_weighted_scoring_rubric": {
    "evidence_freshness": 0.24,
    "surface_precision": 0.2,
    "public_safety_fit": 0.18,
    "verification_strength": 0.18,
    "reversibility": 0.1,
    "complexity_penalty": 0.1
  },
  "next_gates": [
    "capture context fingerprint",
    "run negative-memory retrieval",
    "reproduce targeted failing smoke test",
    "patch only proven boundary",
    "run targeted smoke test and leak scan"
  ],
  "stop_conditions": [
    "repo or branch cannot be confirmed",
    "failing surface cannot be reproduced",
    "private/internal material enters proposed diff",
    "verification requires push or deploy"
  ],
  "countermap_requirements": [
    "c1-context-fingerprint",
    "c2-negative-memory",
    "c3-repo-truth",
    "c4-public-private-boundary",
    "c5-targeted-verification"
  ],
  "gate_runner_implications": [
    "local-only execution window",
    "no deploy or push",
    "truth state remains observed until commands pass"
  ],
  "receipt_status": "complete"
}
